{
  "schema": "aniflow.timed-text/v1",
  "provenance": {
    "kind": "reviewed_lyrics",
    "authority": {
      "supplied_by": "synthetic-fixture-author",
      "provenance_artifact_id": "review_evidence"
    },
    "evidence": {
      "id": "review_evidence",
      "sha256": "f7eed62d0a0e12c8b7f37228ad0fe3b836b9e40f1d7b0c17975b67816ee625bf",
      "byte_size": 197
    },
    "source_sha256": "9851f68b0d7d244d56828e9ed94c572873b04ebb34afa9fa4104c8005cece30b"
  },
  "language": "ja",
  "audio_source": {
    "artifact": {
      "id": "source_audio",
      "sha256": "9bf857f5d07d4f812ce979c0c6a882a4eedfe794421e2939ec5f4bb6a9f56f8e",
      "byte_size": 264644
    },
    "stream_index": 0,
    "sample_rate_hz": 44100,
    "channels": 1,
    "frame_count": 132300,
    "origin": {
      "numerator": 0,
      "denominator": 1
    },
    "stem": null
  },
  "overlap_policy": "reject",
  "source": {
    "id": "source_text",
    "sha256": "9851f68b0d7d244d56828e9ed94c572873b04ebb34afa9fa4104c8005cece30b",
    "byte_size": 108
  },
  "metadata": {},
  "cues": [
    {
      "id": "cue_000001",
      "source_label": "7",
      "text": "Café — こんにちは",
      "timing": {
        "kind": "interval",
        "start": {
          "numerator": 0,
          "denominator": 1
        },
        "end": {
          "numerator": 5,
          "denominator": 4
        }
      },
      "speaker": null
    },
    {
      "id": "cue_000002",
      "source_label": "42",
      "text": "naïve é 🌙",
      "timing": {
        "kind": "interval",
        "start": {
          "numerator": 3,
          "denominator": 2
        },
        "end": {
          "numerator": 5,
          "denominator": 2
        }
      },
      "speaker": null
    }
  ]
}
